{
  "bundle_id": null,
  "bundle_version": "klein.run_bundle.v1",
  "created_at": null,
  "created_by": "klein-protocol",
  "entries": {
    "artifact": "artifact/input.kleinc",
    "conformance_report": null,
    "hail": "hail/observables.jsonl",
    "run_manifest": "manifest/run_manifest.json",
    "signed_conformance_report": null,
    "trust_policy": "trust/trust_policy.json"
  },
  "hashes": {
    "artifact": "sha256:bfb5b9edbf33f5328072c0a930699019a02723de968c8a1065b23758a5a32be1",
    "conformance_report": null,
    "hail": "sha256:f56eba6e75d87ba550afe6d7d687da7832c88c3757a3b2fbf7360296899cc913",
    "run_manifest": "sha256:dc00c22d126682259efc14c6fa91cce3f806a56e4a3b0a589870752cde165a43",
    "signed_conformance_report": null,
    "trust_policy": "sha256:a98e99e92ca905096b4786589ed1f4ed906b668a8eb1d1d46136495b46a20f5c"
  }
}
